Web Site|Meet Loretta|On the Issues|Helping You|Newsroom|Contact MeDear Friend &ndash;The holiday season is fully underway and I for one find myself thinking about all those healthy resolutions I'll make&hellip;next year.,positive,0.754315
"But there is something that simply cannot wait: signing up for quality, affordable health insurance through Covered California.",positive,0.896608
"If you want coverage beginning January 1, 2015, you have to enroll by December 15, 2014.",neutral,None
"If you already have coverage,it's time to come back and renew itunless you have Medi-cal, which will contact you about next steps.",neutral,None
"If you don't have coverage, visit CoveredCA.com, call (800) 300-1506, orfind in-person localhelp to learn about the plans in your area, to see what financial assistance is available and get covered.",positive,0.634246
"For every family member enrolling for health insurance, you will need:Proof of current incomeCA ID or driver's license of the person who is applying for the familyUS passport, legal resident card or certificate of citizenship or naturalization documentationBirthdatesSocial Security NumbersHome Zip CodeIf you have any questions, please don't hesitate to contact my District Office at (714) 621-0102 or visit my website at lorettasanchez.house.gov/EnrollOC.",neutral,None
"Very truly yours,Loretta SanchezMember of CongressPrivacy Policy|Unsubscribe",positive,0.398956
