Web Site|Meet Loretta|On the Issues|Helping You|Newsroom|Contact MeDear Friend -Earlier this week I signed a discharge petition demanding that comprehensive immigration reform be brought to a vote.,neutral,None
The petition would force a vote on H.R.,neutral,None
"15, the bipartisan Border Security, Economic Opportunity, and Immigration Modernization Act, legislation that would help secure our border, protect our workers, unite our families, provide an earned pathway to citizenship and create jobs.",positive,0.712475
I signed this petition because enough is enough - the American people demand a vote on comprehensive immigration reform.,positive,0.832714
It's been almost a year since the Senate passed this bipartisan package and report after report has demonstrated the economic imperative of reform.,neutral,None
I am demanding a vote because we've been saying &lsquo;the time is now' for too long.,negative,-0.203809
Action on immigration reform is overdue and I am ready to put the pressure on every member to take a stand.,neutral,None
"Join the chorus for reform and sign the#DemandAVotePetition here:http://www.dems.gov/timeisnow/Thanks as always,Loretta SanchezMember of CongressPrivacy Policy|Unsubscribe",neutral,None
